{
  "formatVersion": "0.1.0",
  "recordId": "00000000-0000-4000-8000-000000000006",
  "incidentDate": "2025-07-15",
  "location": {
    "name": "Ireland"
  },
  "physicalChanges": [],
  "ecologicalEffects": [
    {
      "id": "ecological-1",
      "type": "ECO_MORTALITY",
      "status": "OBS_ESTIMATED",
      "description": "Illustrative report of house martin mortality.",
      "affectedEntity": {
        "commonName": "House martin",
        "scientificName": "Delichon urbicum",
        "estimatedCount": 205
      }
    }
  ],
  "evidence": [],
  "climateAssessment": null
}